,id,parent_id,parent_tweet,tweet,topic,classification
1069,552840158329200640,552832817089236992,Stills from eyewitness video show two CharlieHebdo attackers wearing hoods &amp; black clothing shoot a wounded man,I hope They are taken alive,charliehebdo,comment
1070,500327106824245249,None,,"All weekend ppl will be talking about the ""robbery"" instead of the shooting bc Ferguson PD didn't release any info about the shooting.",ferguson,support
1071,544275851559579648,544273516397219841,Guess Sydney's off our list.....,"well, not today, for sure.",sydneysiege,support
1072,552821069036670976,None,, CharlieHebdo cartoonists killed: - Charb - Cabu - Tignous - Georges Wolinski JeSuisCharlie,charliehebdo,support
1073,500392623107223552,500392059832770560,no doubt scared for his life. It's obviously mike brown in the video,Obviously? So he took off his socks in the m between the video and getting shot?,ferguson,comment
1074,544288960642834432,544282661909323776,"And that time is now, they have brought it to us, they'll be sorry",where are you sue in oz ?,sydneysiege,query
1075,544299767195779072,544282005941530624,Hostages in Sydney cafe made to hold up Islamic flags,don't they have strict gun laws in Australia? I see that's working well.,sydneysiege,comment
1076,544316370687913984,544316287598358528,don’t they mean “siege pricing”?,- well played sir.,sydneysiege,comment
1077,500397151739215872,500394061887709184,"The press conf makes Ferguson PD look like they've gone from stonewalling to counter punching. We give up a name, we drag his thru the mud.",I would rather be a robber than being a ColdBloodedMurderer JusticeForMikeBrown Now,ferguson,comment
1078,544282005941530624,None,,Hostages in Sydney cafe made to hold up Islamic flags,sydneysiege,support
1079,499538310986219520,499530130487017472,A woman in Ferguson was shot in head last night and released this selfie. Conflicting reports of how it happened:,wow.,ferguson,comment
1080,500393982992470016,500393552946282496,actually I did use the word robbery,Your post states theft. What am I missing?,ferguson,comment
1081,552791196247269378,None,,"BREAKING: At least  killed in shooting at French satirical newspaper Charlie Hebdo, Paris prosecutor's office says.",charliehebdo,support
1082,553228413922967552,553221600955621376,"Clarissa,  years old, police trainee of Montrouge Police in France. Victim of this morning's attack. via",RIP,charliehebdo,comment
1083,524943490887991296,None,,"CONFIRMED |  shooter shot dead at Parliament Hill, but there is more than  suspect. cbcOTT OTTnews",ottawashooting,deny
1084,544341800719106049,544333969970302977,.iGottaTravel Seems. A global marketing disaster Uber is trying to fix.,for sure,sydneysiege,comment
1085,553507679621378049,553506608203169792,"Map shows industrial estate where  CharlieHebdo suspects are holed up, surrounded by police",you're in the news again bro,charliehebdo,comment
1086,552835278625177600,552833272724852736,Sickening. Frenchmen must demand and election and voted FN to get those swine out of their country. This is a MUSLIM problem.,"Islam does not condone such swine behavior or violence in anyway shape or form. Its a psychiatric problem,!",charliehebdo,comment
1087,500285663271718914,500279189405433858,"That was very ""SLICK"" of the Police Chief to create a narrative that MikeBrown was a ""suspect"" in a robbery! Ferguson",Come on now.......openminds,ferguson,comment
1088,576847084579618816,576846509632798720,What are your thoughts on WhereIsPutin?,"Either a simple flue, more serious illness or serious domestic political problems.",putinmissing,comment
1089,552825292184514561,552806757672964097,"UPDATE:  now confirmed dead in CharlieHebdo attack in Paris, is reporting. Story: (AP)","* US Citizens!! :Fbruary . health insurance deadline ObamaCare Register and Go to the hospital to get sick,your health!!",charliehebdo,deny
1090,500396253327687680,500396139305517057,There are lots of us out there. Promise.,we all need to unite then. solidarity is key in the face of adversity and prejudice.,ferguson,comment
1091,500402352919445504,500399589417963521,If he was shot in the back he was running away but shot in the chest he could have been charging.,"confused how an unarmed person, charging, retreating, or standing still, is a threat to a cop ' away",ferguson,deny
1092,552801740652036096,552793679082311680," confirmed dead, Francois Hollande to visit scene of attack - latest from Paris:",lol nd u lot wanted to go paris to get our headgears ripped off,charliehebdo,comment
1093,553551171802382336,553550000584540160,StopKillingInnocentPeople FreePalestine freeBurma FreeSyria FreeKashmir,Two wrongs won't suddenly become right and two tragedies can never be compared - neither by quantity nor by quality.,charliehebdo,comment
1094,544301918773075969,544301643194716160,"“PzFeed: BREAKING UPDATE: Gunman says four devices are located around Sydney. Security response underway. Police calling for calm."" RIP",u wot m?,sydneysiege,comment
1095,553175352366100482,553160652567498752,French police: Said Kouachi and Cherif Kouachi wanted in Paris terror attack:,look his face they are moeslim and they is vandals everywhere..shit moeslim.,charliehebdo,comment
1096,500344847661006848,500344082804518913,To think after all this time a lame-assed story about stolen cigars is going to fly is beyond stupid!,"Affluent people and those in authority take it as an affront to be questioned, especially by lesser people",ferguson,comment
1097,544314872985423872,544314234541469696,Uber intros surge pricing in downtown Sydney during hostage siege,I love the service but this is classless,sydneysiege,comment
1098,501336276285788160,501295330210885632,"Who is 'other person?' st police LIE saying friend confessed. Under pressure, they now say he was not involved","st interview politicsnation DorianJohnson mentions cigarillos &amp; told lawyer. Video shows he gave back, not Mike Ferguson",ferguson,comment
1099,552792555944153088,552791196247269378,"BREAKING: At least  killed in shooting at French satirical newspaper Charlie Hebdo, Paris prosecutor's office says.",Omg...what is the world turning into. ..,charliehebdo,deny
1100,500379473326665728,500379221504442370,wait.....what???!!!,"Yes, you read that right. click the link and read the whole thing",ferguson,support
1101,500356990917681152,500354773133299713,"In , Ferguson police beat a man and charged him for bleeding on them:","“ComplexMag: In , Ferguson police beat a man and charged him for bleeding on them:",ferguson,comment
1102,553591850532347906,553590835850514433,"Hostage-taker in supermarket siege killed, reports say. ParisAttacks",What about his girlfriend wanted by police ?,charliehebdo,query
1103,524977621281824770,524977413038817280,You need to flake off ass....,stay classy.... I'm sorry that a tragedy ruined your ability to watch a sporting event.,ottawashooting,comment
1104,544391533240516608,None,,Five hostages have escaped the besieged Lindt Cafe in Sydney | Our latest update:,sydneysiege,support
1105,529540733020405760,None,,"PRINCE IN TORONTO TONIGHT: tweeted this morning to say OTNOROT CALLING, which is Toronto backwards, obviously.... Seems it's on!",prince-toronto,support
1106,500377411469733889,500377145349521411,to be clear: an unarmed teenager POSSIBLY stealing a box of cigars does not warrant being shot to death by the police. Ferguson,not even if he IS stealing.,ferguson,comment
1107,544333770900242432,544282005941530624,Hostages in Sydney cafe made to hold up Islamic flags,RT Hostages in Sydney cafe made to hold up Islamic flags Australia Islam sharia,sydneysiege,support
1108,552850999443202049,552848620375261184,Witnesses say the Charlie Hebdo gunmen identified themselves as members of al-Qaida:,,charliehebdo,deny
1109,500451964283789313,500442407830581248,.JPantsdotcom Why do you start your question with a lie?,sorry what now?,ferguson,query
1110,524965821337329666,524965546379739136,In historical terms this is a blip. Screw those losers.,"a) actual ""terror"", b) nutbars, c) false flag. all  r plausible",ottawashooting,support
1111,552822921698500608,552811386259386370,At least  dead in the Paris shooting. Updated story and background info: CharlieHebdo,RIP some actions are beyond comprehension. Sadly the dead most likely had nothing to do with the anger &amp; twisted mind of the gunmen.,charliehebdo,comment
1112,525025279803424768,None,,The soldier shot dead in Wednesday's Ottawa attacks has been named as Cpl. Nathan Cirillo of HamOnt ottawashooting,ottawashooting,support
1113,552805557896482816,552805237510385664,a provocation is an invitation !!,You are a mad cunt go fuck yourself,charliehebdo,comment
1114,500390919951351808,500389488217309184,Ferguson chief let most of day go by b disclosing (after repeated Qs) that cop who killed MikeBrown knew nothing about robbery. DANGER,Lisa is he the confirmed robber?,ferguson,query
1115,500363126294863876,None,,The Ferguson police chief just basically confirmed MikeBrown was gunned to death for the crime of walking in the street? Horrific.,ferguson,support
1116,552796307627470848,552791578893619200,Eleven dead in shooting at Paris offices of satirical magazine Charlie Hebdo – live updates,Shocking news.,charliehebdo,comment
1117,525023033585827840,524993533212897281,"FBI assisting in the case of the Ottawa shooting, sources have confirmed to CTV News",shooting suspect,ottawashooting,comment
1118,500374119725031424,500373096860487680,no offense  u sir but unless he was reaching  a gun then there was no reason for this to happen,no offense taken sir and normally I would agree with you but their is more to this story.,ferguson,deny
1119,524936266517733376,524935485370929152,Shooting in Canadian parliament comes day after ISIS-inspired radical drove in Canadian soldier. Also reports of shooting at War memorial/,People R radicalising because their democracy is being radicalised by Elite.,ottawashooting,comment
1120,553506956686532608,553505242554175489,"Suspects in CharlieHebdo attack spoke to police by phone and said they wanted to die as martyrs, says French MP.","“cnni: Suspects in CharlieHebdo attack spoke to police by phone and said they wanted to die as martyrs, says MP.",charliehebdo,comment
1121,529716453792956416,None,,Is Prince in Toronto? Rumours fly of surprise show...,prince-toronto,comment
1122,544514424476680193,544512664769396736,"BREAKING: Police enter Lindt cafe, hostages flee sydneysiege","“RT_com: BREAKING: Police enter Lindt cafe, hostages flee sydneysiege",sydneysiege,support
1123,500410061974290433,500402881737289728,"Since they want to label MikeBrown as a shoplifter, since when is that crime punishable by DEATH?",Not sure 'shoot first &amp; uncover potential crime later' is viable policy outside the fevered mind of a conservative,ferguson,comment
1124,553548166629691392,553547724860456961,*Mutes Universe*,It's that kind of day. The kind where you want to go back to bed with some fiction to distract.,charliehebdo,comment
1125,500286677303058432,500283003323842560,Ironic since all the i witnesses say the officer was white. Now it is the black officer Darren Wilson who shot??,I haven't seen anyone say he was black. It is a somewhat common name.,ferguson,comment
1126,524962753099075584,524962142563610625,BREAKING Rick Hughes at CBC Hamilton: The soldier who was shot in Ottawa Wednesday morning is a reservist serving in Hamilton,is he alright?,ottawashooting,query
1127,524923432933552128,524922729485848576,Only photo I will tweet. CPR being performed on the soldier now. I heard four shots. ottawa,thank you for posting. It may just be hard to tell in the picture but bystanders look quite calm considering gunfire in area.,ottawashooting,comment
1128,544349089890959360,544329632565452801,This sounds like made up BS,It's not made up but I think there is only  offender with muslim flag &amp; local news didn't mention suicide belt,sydneysiege,comment
1129,544273610311876608,544269749405097984,BREAKING: Live coverage of hostage situation unfolding in Sydney's Martin Place,Terrifying “newscomauHQ: BREAKING: Hostage situation unfolding in Sydney's Martin Place,sydneysiege,comment
1130,500385201181052928,500384869419978752,Was he shot in the chest or back? From ' away or ' away? Which wounds came first?,They've already said he shot him once from the car. Christ.,ferguson,comment
1131,500313313188663296,500308076004929537,"Possible ""robbery"" took place and BAM! Like magic it's as if another UNARMED black youth being murdered has been forgotten smh Ferguson","Even if he had robbed a convenience store, that's no excuse for murder.",ferguson,deny
1132,524975908432928768,524975705206304769,NHL cancels tonight's game between Ottawa and Toronto due to today's shootings. Senators were to host Maple Leafs.,"game postponed, not cancelled.",ottawashooting,support
1133,553541618993618945,553538058440941568,"MORE: France: Shooting, hostage-taking at kosher market in Paris; several reported wounded:","Of course Jews get dragged into this “AP: MORE: France: Shooting, hostage-taking at kosher market in Paris:",charliehebdo,comment
1134,553551676700098561,553550301886955520,"BREAKING: One person seriously wounded, six taken hostage in incident at kosher supermarket in Paris: police source",incident?,charliehebdo,query
1135,524930715021213696,524926744714047488,", well blame Steven Harper , he's all for guns , wants this country to become like the US of A",Seriously? Likelihood that it's an ISIS attack and THIS is your response???,ottawashooting,comment
1136,500571622303367168,500302378931716096,"There are pics of ""strong arm robbery"" clothing description/size of assailant similar BUT cop deadly force? No!",Chief admits 'friend' did NOT confess to a crime! Cop did not stop Michael as a suspect! LIES!,ferguson,comment
1137,499370209442942976,499368931367608320,"Currently the FoxNews website has zero, repeat, ZERO coverage of the Ferguson protests, probably due to lack of cowboy hats.",“clydetheslyde: Currently the FoxNews website has zero/........as the three wise monkeys commented 'see no evil hear no evil speak no evil,ferguson,query
1138,553188394113986561,553184482241814530,"I am still confused as to why these ""highly trained"" individuals left their ID in the getaway car. CharlieHebdo","Unless you've got military experience, its hard to understand how much stress your brain undergoes in battle.",charliehebdo,comment
1139,553532938508587008,553531413459660800,Update - AFP says gunman who has taken a hostage at kosher supermarket in Paris believed to be suspect in killing of policewoman on Thursday,Presume they wanted a Jewish hostage. So much for martyrdom. Why a kosher deli particularly?,charliehebdo,query
1140,552807393453547522,552806309540528128,“LePoint: CharlieHebdo : “The cartoonists Charb &amp; cabu are dead.”,oh god. No.,charliehebdo,comment
1141,552818327521734657,552817735160176641,it is a disgrace in Judaism. And christianity. It's applauded in Islam. Child rape pretending  b marriage,come on Rabbis have wives as young as six. Hehehe. What is that not rape and pedophiles,charliehebdo,comment
1142,553519836249071617,553518472798683136,MORE: Official: French terror suspects want to be martyrs; are holed up with hostage north of Paris:,Conceal and carry law coming to France...,charliehebdo,comment
1143,553544694765215745,None,,French police publishes photos of suspect in yesterday's Montrouge shooting. Maybe the same persons in Kosher market,charliehebdo,support
1144,553183997090889730,553160652567498752,French police: Said Kouachi and Cherif Kouachi wanted in Paris terror attack:,there is NoModerateIslam EnoughIsEnough JeSuisCharlie,charliehebdo,comment
1145,544333222801186816,544330294275235842,FALSE FLAG OPERATION CIA BLACK OP,when it started to appear on M$M the narrative was the same. ..Like say a Script..I mean 'goverMENt press release ..fishy..:(,sydneysiege,comment
1146,524977699584897024,524976953707999232,I just think we need a change,"perhaps, Trudeau is not that change. He's out of touch with most Canadians, he's not ready to run this country.",ottawashooting,comment
1147,544292970074087424,544292129972170752,BREAKING ALERT: Preliminary reports indicate perpetrators appear to be members of ISIS. SydneySiege,no.,sydneysiege,deny
1148,544301461845188608,544268732046913536,BREAKING: Hostages are being held and a siege is taking place at Sydney's Lindt Chocolat Cafe in Martin Place.,Wow! I was just there RT BREAKING: Hostages are being held &amp; a siege is taking place at Sydney's Lindt Cafe in Martin Place,sydneysiege,comment
1149,524969813865545729,524966904885428226,BREAKING UPDATE: Canadian soldier injured at Parliament Hill shooting dies Ottawa,yes parliament attached at  am eastern time,ottawashooting,comment
1150,500385933523304448,500384718496747520,that I don't like racial profiling and think police should obey the law? That is definitely my agenda.,No that you see this as a racial situation before you know anything.,ferguson,comment
1151,553195530273456128,553152395371630592,This widely shared cartoon about the CharlieHebdo attack is actually by and not Banksy,pm grateful for that tweet,charliehebdo,comment
1152,524937721383755776,524936872666353664,More shots fired just off Parliament Hill. Police telling everyone to take cover.,Canadians will be vigilant and strong. We won't be 'bullied' and intimidated. ParliamentHill,ottawashooting,comment
1153,499990307291664384,499612545909415938,"Nearly k blacks were murdered last yr--almost all by other blacks. A tiny % were unarmed-killed-by-cop. Where's Al, Jesse? tcot ferguson",Indeed where?,ferguson,query
1154,553220108219609088,553152395371630592,This widely shared cartoon about the CharlieHebdo attack is actually by and not Banksy,MT widely shared cartoon about the CharlieHebdo attack by,charliehebdo,support
1155,499427932935180289,499368931367608320,"Currently the FoxNews website has zero, repeat, ZERO coverage of the Ferguson protests, probably due to lack of cowboy hats.",".clydetheslyde It's the lack of property damage. On Fox, it's property&gt;people",ferguson,comment
1156,500399953295208448,500394428243390465,Shoving a clerk means you'll take on a police officer with a gun? SoundLogic YesThisIsSarcasm MikeBrown,it prevented future crimes by MikeBrown,ferguson,comment
1157,500298040511451136,500294985376608256,The cops can't spin this unlawful shooting try as they may. Police Dept. credibility ruined with Ferguson community.,.mmwlawtaos - Spin still doesn't justify the murder versus the arrest. Why did the Ferguson officer not call for backup?,ferguson,support
1158,525025735338381313,525023025792835585,RIPNathanCirillo RT Soldier killed at war memorial identified as Cpl. Nathan Cirillo OttawaShooting,May he rest in peace.respect,ottawashooting,comment
1159,524940223160287232,524936650087231488,there has been zero confirmation that gunman is down. Maybe let news outlets on scene handle the reporting.,why shouldn't a private citizen make a comment on a news event?,ottawashooting,support
1160,553008182050947072,553005429492445184,I'm not buying the bullshit that there's good Muslims. The Islamic religion is fucking evil.,Islamaphobe,charliehebdo,comment
1161,498456361286795265,498432131669192704,"cool! Darkskinned man is a crime element in your village?? So, why obama is alive yet???",Is People Like You That MURDER UNARMEDBLACKS You Ask Why Is Obama Still Alive.RACIST KKK SMH,ferguson,comment
1162,524964503579262976,524964193813155841,,perhaps wishful thinking on my part but still hopeful it is not true. TV still not reporting any CF deaths,ottawashooting,comment
1163,524931034329395200,524927281048080385,Snipers set up on National Art Gallery as we remain barricaded in Centre Block on Parliament Hill cdnpoli.,very helpful why would you tweet that!!??,ottawashooting,deny
1164,544519105026719744,544515538383564801,"Haron Monis,Hostage-taker in Sydney: Fled Iran ,suspect in ex-wife killing, sex assaults",seems like an affable chap,sydneysiege,support
1165,544292184476758016,544291965513134080,"According to Seven, this is a picture of the gunman",What is wrong with you,sydneysiege,query
1166,544514837301043200,544512676643500033,BREAKING freed hostage borne high from sydneysiege w/c. paramedic teams on the scene ( carsonscottLI,Why was this mongrel on bail?,sydneysiege,comment
1167,524961283523612673,524960426132791296,"what's stupid is we are at war but moan when it's on our own soil now they are using chemicals so it's WHEN, BEWARE","true..!!! bt its nt nice to say ""i told u so""..wen ur country is at siege...!! we can say it later..!!",ottawashooting,comment
1168,524971522126270464,524969798170869761,"no, radical Muslim extremists are making us victims.",canada has never been this dangerous before until harperadminstration changed their FP,ottawashooting,comment
1169,544282314931707904,544278985249550337,Geoblock lifted on ABCNews. Streaming coverage of the Martin Place siege in Sydney here,fingers crossed this ends well and swiftly.,sydneysiege,comment
1170,500291543631429632,500284023340818433,"Indicate? If he was a suspect why did the police stop his car next to him and tell him to ""get the fck on the sidewalk"" ?",.EvilLiberal GOOD POINT. walkingonsidewalkwhileblack cc,ferguson,deny
1171,544290355068166146,544290258951892992,Central Sydney shut down by police amid ongoing hostage situation:,“WSJ: Central Sydney shut down by police amid ongoing hostage situation:,sydneysiege,support
1172,524971151693729792,524969935383326721,from the same cops and government who tell us that cancer-curing marijuana is evil.,"The science is ongoing, it can't cure, I got a link hang on...http://t.co/MmfTPusPH",ottawashooting,comment
1173,500390243716304896,500389488217309184,Ferguson chief let most of day go by b disclosing (after repeated Qs) that cop who killed MikeBrown knew nothing about robbery. DANGER,"that's unfortunate. signed, ferguson PD",ferguson,comment
1174,544323425993371649,544310853613281281,The Sydney cafe siege may be part of a larger plot. MartinPlaceSiege,please dont scare people by speculating whats gonna happen.. My prayers to all the people taken hostaged.. :(,sydneysiege,comment
1175,500281475141357568,500281131057811456,"BREAKING NEWS: According to documents released to the press, MikeBrown was connected to an earlier robbery Ferguson",LIES! MikeBrown was not wanted  robbery otherise his friend would hv been considered an accomplice...COVERUP Ferguson,ferguson,deny
1176,544511082472415232,544510450101415936,"Several more hostages flee from cafe under siege in Sydney, local media say",,sydneysiege,comment
1177,524972276345622528,524971955381092353,you guys don't realize that harder is a snake and your lives are at stake because of him,"Justins' new book spoiler alert. ""My dad was famous...the end""",ottawashooting,comment
1178,553568091980824576,553567740104286209,the st has been on for h and the second for hrs,Thanks. I think posing these situations in context helps us better understand. We are far away. Peace paris,charliehebdo,comment
1179,544514139784478720,544512910538838016,"UPDATE: Hostages fleeing Sydney cafe held by Iranian gunman as explosions, gunshots are heard:",- Just think if they allowed their people to carry guns. He would have been dead  minutes after taking hostages. GunsSaveLives,sydneysiege,comment
1180,524926472432410625,None,,"One person shot outside Centre Block, a second wounded inside the building in Parliament Hill shooting",ottawashooting,support
1181,499690552821284864,499689772928204800,So I guess you are saying it is no big deal for cops to kill unarmed black kids??? WTF.,.PhilSerrin Has that been proven? I haven't heard your news account. Isn't the investigation of account still ongoing?,ferguson,query
1182,500284524971188224,500280838710247424,"Police reports released this morning indicate Mike Brown was a suspect in a ""strong-armed"" robbery in Ferguson",A pack of cigarettes = strong armed robbery.... You guys are getting ready to stir the pot again.,ferguson,comment
1183,552800910670569472,552792544132997121,BREAKING Charlie Hebdo latest:  dead  wounded (five critical) two gunmen unaccounted for,Wild West Politics: Western Europe is suffering from its internal contradictions; welcome to the tribal politics of the future.,charliehebdo,comment
1184,500363740311982081,None,,What's so frustrating is that now we are talking about a robbery and not the killing of an unarmed kid. ferguson,ferguson,support
1185,544275772416880640,544271284796784640,"DEVELOPING: Gunman Takes Hostages In Sydney Cafe, 'ISIS' Flags Being Held Against Window -",bet they're happy they let those goat humpers into the country.,sydneysiege,comment
1186,553507344932294657,553506608203169792,"Map shows industrial estate where  CharlieHebdo suspects are holed up, surrounded by police",,charliehebdo,comment
1187,524930594464362496,524925987239120897,Soldier shot at National War Memorial in Ottawa cdnpoli hw,Gunfire inside Canadian parliament; soldier shot at National War Memorial in Ottawa cdnpoli,ottawashooting,support
1188,500280140560338944,500279189405433858,"That was very ""SLICK"" of the Police Chief to create a narrative that MikeBrown was a ""suspect"" in a robbery! Ferguson","Yeah...I caught that too. ""VERY SLICK"" Seeing the framing of the lie starting now!",ferguson,support
1189,544520507580628992,544520273718812672,Police confirm that sydneysiege is finally over. Two people reportedly injured after suffering gunshot wounds,so thankful everyone's safe it's been a long day,sydneysiege,comment
1190,552812099294863362,552808109551263744,"I hate this. I hate that artists, journalists and funny people are killed in hate's name.",Exactly.,charliehebdo,comment
