,id,parent_id,parent_tweet,tweet,topic,classification
0,501760642928635904,500961800868098049,"Heard that friend was not going to be ""charged"" in any robbery since video shows it was other person","This shows Michael paid for cigarillos. No robbery, no crime! Pls RT",ferguson,comment
1,500270212198174720,500258409988763649,"Name of Ferguson cop is expected to be released by  ET, police chief says: (J.B. Forbes, AP)",Get ready to tweet the address SpikeLee and other vigilantes .,ferguson,comment
2,524971210275565568,524969798170869761,"no, radical Muslim extremists are making us victims.","your radical Muslims are being funded by American Senate, Israel and Saudia Arabia",ottawashooting,comment
3,552836882770690049,552833028201144320,URGENT:  gunmen involved in deadly attack on CharlieHebdo - French interior minister Paris,Just kill them.,charliehebdo,comment
4,500289931097296897,500288349924782080,Did anyone think of comparing the clothes that MikeBrown was wearing when he was laying on the street to the security footage? Ferguson,"no, because that would require reasoning and then if reasoning is applied, no one can be shot. Shoot now, reason later.",ferguson,support
5,544293230649810944,544289311504355328,Statement from Prime Minister Tony Abbott on Sydney hostage situation.,AU GOV and Tony Abbott is responsible for this mess!! AU Gov created the 'Rebels' Frankenstein in Syria!!,sydneysiege,comment
6,544283032732332032,544280329050005507,really hope this guy doesnt have explosives too :I,u know theres some fucked up people who wants to see him blow up himself,sydneysiege,comment
7,500406679176241153,500406172155777025,And there was a struggle inside the car. How do we know Brown didn't get the gun and fire the shot during the struggle?,why would the ferguson PD and STLCO PD release the information they've released and fail to mention that?,ferguson,comment
8,500300182844878848,500299923980824576,compare the pix... store dude in flip-flops. Mike Brown- pix look like running shoes? (need better pix of Mike Brown in street),Here are pixs I have.,ferguson,comment
9,552811591683821568,552810448324943872,"CHARLIEHEBDO SHOOTING: Gunmen shouted 'we have avenged the prophet"" during attack - reports",,charliehebdo,comment
10,524938343180931073,524935834941001728,so.. Instead of helping you took a picture for profit?,yeah posting information about an evolving shooter situation is less worthwhile than an untrained journalist performing CPR,ottawashooting,comment
11,521360786409943041,521360486387175424,AC Milan midfielder Michael Essien has been diagnosed with Ebola. Get well soon Michael. [Daily Times],no he hasn't,ebola-essien,deny
12,524946532416884736,524944399890124801,Recap: Gunman shot dead inside Parliament buildings; police believe there may be others on loose. Cdn soldier shot earlier at War Memorial.,Hunt them down like the animals that they are!!,ottawashooting,comment
13,544347456238931968,544347216282791936,Uber trips out of the CBD today are free to help Sydneysiders get home safely. See,Thank you!,sydneysiege,comment
14,525020658972258305,525019752507658240,"ISIS Media account posts picture claiming to be Michael Zehaf-Bibeau, dead OttawaShooting suspect. Canada",Which accounts?,ottawashooting,query
15,552817834628501505,552816063369326592,infidels that r breathing offends these monsters. Freedom offends them.,reason forthis massacre is a concrete action of paper.not general principles of freedom.,charliehebdo,comment
16,524959078229880832,524957146656821249,a bullet is just as evel as a bomb we bomb them they shot us but we make a big deal of both,there are times we shld put our stupidness aside nd be feel bad fr wats happening at the moment...!!!!,ottawashooting,comment
17,553588165408473088,553586897168392192,BREAKING : Both Charlie Hebdo suspects killed as police storm building (police sources),"For the record this pic. is the other hostage site, the CharlieHebdo murderers were taken outside Paris: Dammartin",charliehebdo,comment
18,544293748377518080,544291965513134080,"According to Seven, this is a picture of the gunman",You are a danger to the rest of society. Stop posting pics without any verification &amp; creating panic.,sydneysiege,comment
19,553196346375954433,553152395371630592,This widely shared cartoon about the CharlieHebdo attack is actually by and not Banksy,Does this cartoon means that hatred cartoons to holy values will continue?,charliehebdo,query
20,524957146656821249,524956129017995264,"Police say shots fired at  Ottawa sites - National War Memorial, Parliament Hill, and now Rideau shopping centre",a bullet is just as evel as a bomb we bomb them they shot us but we make a big deal of both,ottawashooting,comment
21,524992668301262848,524991576163250176,MORE: Police believe three gunmen were involved in shootings in Ottawa this morning and are looking for two shooters.,Your info is out of date. Rideau shooting didn't happen. Police press conference says nothing about number of shooters.,ottawashooting,deny
22,500294827351621632,500286680381665282,is that Mike Brown? the guy in these pics looks a lot bigger than the pics of Mike Brown in prior still photos released?,He is large. In the store photos you have some prospective unlike the still photos.,ferguson,comment
23,544307827070615553,544281375826665472,so its not an IS flag - must be a peaceful Islamic extremist group then!,It is according to this terrorism expert,sydneysiege,support
24,524955418955902976,524947674164760577,BREAKING NEWS: New York Times is reporting the Canadian soldier who was shot has died from their injuries. Heartbreaking. cdnpoli ableg,maybe you should get your info a little more locally,ottawashooting,comment
25,553541495588802560,553538058440941568,"MORE: France: Shooting, hostage-taking at kosher market in Paris; several reported wounded:","“AP: MORE: France: Shooting, hostage-taking at kosher market in Paris; several reported wounded:",charliehebdo,comment
26,500301494193627136,500301270532370433,"- Even if not innocent, no justification for violating rights, removing due process &amp; execution Ferguson MURDER!",Absolutely my point!!,ferguson,comment
27,525026551411519488,525025463648137216,BREAKING: A source confirms to CP that the deceased soldier in Ottawa is Cpl. Nathan Cirillo. Cirillo was a member of the Hamilton Argylls,I teared up when I heard. RIP Cpl Cirillo.,ottawashooting,comment
28,553565149790224387,553562623200210944,"I think we don't have enough facts about the big picture right now (AQAP/ISIS etc), we'll need to wait and see","ok. I would like to hear your reactions, your personal thoughts, once you have had time to process these events.",charliehebdo,comment
29,544520601038098433,544520273718812672,Police confirm that sydneysiege is finally over. Two people reportedly injured after suffering gunshot wounds,,sydneysiege,comment
30,544284034902528000,544283762201083904,"this might not end well honestly, i wouldnt expect isis to hold somthing up without trying to behead or blow it up",is there a live feed somewhere,sydneysiege,query
31,500319801344929795,None,,"The day Ferguson cops told a dirty, bloody lie (via",ferguson,support
32,524941900223381504,524940223160287232,why shouldn't a private citizen make a comment on a news event?,Not a comment. Stated gunman had been neutralized.Simply not true. Over k followers.Irresponsible.,ottawashooting,deny
33,552818473806491650,552817984524152832,hatred pedophile and disgrace in Judaism . We as Muslims don't accept . What freedom if abuse Islam. Death,go away. Sorry excuse for human,charliehebdo,comment
34,553589038196981760,553588178687655936,Reports: CharlieHebdo suspects killed,Can you confirm the reports that those suspects were killed by French police?,charliehebdo,query
35,544452279441829888,544358533819420672,BREAKING: Three hostages appear to have escaped the Sydney cafe where a siege remains ongoing. sydneyseige,O Lord Save All Hostages in Sydney &amp; Turn Militants  Righteous Ways MSGTheFilm ,sydneysiege,comment
36,553595330009518080,553594432743018496,"that's a good idea, just attach a note saying "" I think this is your shit have it back""",wonder if get the impression we are sick of these extremists and how the government just let them in,charliehebdo,comment
37,500304474616119296,500303952391331843,".orangeseahorse - Even if robbery took place &amp; stop legal, actions after st &amp; d shot &amp; after MikeBrown put HandsUp = MURDER",Besides a person who committed a robbery wouldn't call attention to himself by walking in the middle of the street. It's a lie.,ferguson,comment
38,544519358232674305,544518335019229184,BREAKING: At least two people have died following the SydneySiege.  people are being treated by paramedics.,not good news....,sydneysiege,comment
39,553550998497918976,553550000584540160,StopKillingInnocentPeople FreePalestine freeBurma FreeSyria FreeKashmir,fuck you sarracen and stop islamization,charliehebdo,comment
40,544349614393282561,544346015013167104,Does seem terribly convenient to Abbott's gov't.,he will up oz's military budget then become a huge consultant / board member to 'defense' companies when he retires.,sydneysiege,comment
41,576801654118428672,576800982471962624,Hopefully he got hold of some American CIA provocateurs and sabatoger's in Moscow red handed for killing Nemtsov.,Military Coup to overthrow Putin my st thought buddy. Serious rumours Putin is Dead or Critical. Trying  source,putinmissing,comment
42,552815897425891328,552814516262555648,hehe u Jews are good by changing subjects.open another topic. We are talking of anti semitsm and anti islam,anti semitism results in ppl killing Jews. But Jews don't slaughter anyone for offensive cartoons,charliehebdo,comment
43,500319394325479424,500317100704288768,Someone needs to explain how the cop shot MichaelBrown &amp; then NEVER called an ambulance?,.bucci - Wilson knew he intentionally killed an alleged suspect trying to surrender to him &amp; people saw it.,ferguson,comment
44,544991347304714240,544505605567041536,It has everything  do with Islam. U dont see the Jehovah's witnesses cutting heads off &amp; bombing people!,No. It's fanatics. All religions have extremist factions and they're all wrong...,sydneysiege,comment
45,553589051044151296,None,,Several hostages freed at Jewish supermarket in Paris. Photo Thomas Samson AFP,charliehebdo,support
46,524925730053181440,None,,"Shooter still on loose after uniformed soldier shot at Ottawa's War Memorial, across road from Parliament. MP's being taken out of offices.",ottawashooting,support
47,544355074672033792,544320787436433409,Stick to the facts and stop trying to scare thr australian puplic!,their entire coverage has been a joke. See the uni professor explain hypotheticals in hostage situations?,sydneysiege,deny
48,544285782639267840,544278985249550337,Geoblock lifted on ABCNews. Streaming coverage of the Martin Place siege in Sydney here,"Ta, trying that one too. I'm on this one",sydneysiege,comment
49,524969433308340224,524967855105007616,all I am trying to point out is that sensationalism has never been very useful to anyone. Canada terror,"I think that what they are doing around the world is ""sensational"". It's about time we matched it.",ottawashooting,comment
50,525000734992248832,524999052367527937,"Getting the word out about an active shooter situation seems pretty helpful, but please, tell us what you'd have done.",we won't agree on this and that's okay. If you're in Ottawa stay safe.,ottawashooting,deny
51,525031054537936897,525025279803424768,The soldier shot dead in Wednesday's Ottawa attacks has been named as Cpl. Nathan Cirillo of HamOnt ottawashooting,Rest in peace. An innocent life taken so tragically. In our hearts and prayers.,ottawashooting,comment
52,552812322075729920,552806757672964097,"UPDATE:  now confirmed dead in CharlieHebdo attack in Paris, is reporting. Story: (AP)",This is not about political correctness. These medieval assholes want to destroy fee speech &amp; western values: War.,charliehebdo,deny
53,499456567990026240,499456140044824576,St. Louis Co Police tell me ofcr shot a man who pointed handgun at him at Chambers &amp; Sheffingdell at about  a.m. Man in critical. ferguson,source?,ferguson,query
54,544520807074918400,544518335019229184,BREAKING: At least two people have died following the SydneySiege.  people are being treated by paramedics.,not confirmed,sydneysiege,deny
55,499532946412687360,499532679059374081,gm wow just cld Potus all but N wrd on air.Birthers,"when u spew racism,hate of us blks&amp;Potus u shw slvs",ferguson,comment
56,544370150359572480,544367462012432384,"MORE: Police confirm  hostages escape Sydney cafe, unknown number remain inside Sydneysiege",Not cool Yo! My Prayerz hope that hostages make it out safe,sydneysiege,comment
57,544284571626635266,544283772569788416,Live Updates: Siege in Sydney Cafe,Send in the British SAS it will be over within mins,sydneysiege,comment
58,552852233901965313,552832817089236992,Stills from eyewitness video show two CharlieHebdo attackers wearing hoods &amp; black clothing shoot a wounded man,brain washed fanatics. The amount of fervor needed to commit such a horrific act is unimaginable.,charliehebdo,comment
59,499459462965362688,499453449206239232,I was raised by a hater; + knew very wrong-always.But it baffles me w Diversity in creation y ppl hate rt race..,HatersHate and LiarsLie,ferguson,comment
60,553237817086967809,553160652567498752,French police: Said Kouachi and Cherif Kouachi wanted in Paris terror attack:,COWARDS less than humans,charliehebdo,comment
61,524964692423630849,524938903762268160,stay safe. Hope you're never in the same situation.,well said,ottawashooting,support
62,524937817924067328,524925215235911680,BREAKING news: Shots fired at Parliament Hill. Follow developing story:,,ottawashooting,comment
63,524939106367721472,524932935137628160,The gunman in Ottawa has been shot and killed. I'm at a loss for words this morning. That isn't my Canada.,my thoughts also,ottawashooting,support
64,553591557325336576,553590835850514433,"Hostage-taker in supermarket siege killed, reports say. ParisAttacks",,charliehebdo,query
65,552844745647460352,552844369649098754,I don't have it.. why don't you try her here,Thank you for the reply mam. Really appreciate. I have tweeted mam also.,charliehebdo,comment
66,553578217387614208,553576010898497536,Breaking: Gunman at Paris store threatens to kill hostages if CharlieHebdo suspects are harmed.,Omg “WSJ: Breaking: Gunman at Paris store threatens to kill hostages if CharlieHebdo suspects are harmed.,charliehebdo,comment
67,552814012791279617,552810448324943872,"CHARLIEHEBDO SHOOTING: Gunmen shouted 'we have avenged the prophet"" during attack - reports",pussies,charliehebdo,comment
68,524961643688890368,524959809402331137,Senior U.S. official: Canadian government has informed U.S. that one shooter is dead in Ottawa. Live blog:,US official - whatever. Take your source from the Canadian government what has your channel become,ottawashooting,comment
69,524991797630865408,524991576163250176,MORE: Police believe three gunmen were involved in shootings in Ottawa this morning and are looking for two shooters.,The police chief just totally dodged that question and wouldn't say there was more than ..jUst FYI,ottawashooting,comment
70,500281521841139712,500279160795721728,"Question for Ferguson police chief? If OFFICER DARREN WILSON was in pursuit of a robbery suspect, why tell kids to get out of the road? LIE","I could not agree more, it just plain sounds preposterous. And why did he NOT get OUT of the car. It has to be a huge LIE.",ferguson,support
71,544280076628414464,544272537341812736,SYDNEY SIEGE: Gunman forces hostages to hold up ISIS flag in window,Oh dear! PRAY for these innocent people in Sydney who are being held up in a Cafe just before Christmas! Good Lord Almighty!,sydneysiege,comment
72,553587741720854528,553587377835614209,“AFP: BREAKING CharlieHebdo gunmen's hostage freed and safe after police assault” Hoping this is accurate.,"If so that hostage will be the person best able to give an insight into the attack, if the suspects were responsible...",charliehebdo,query
73,553552100417110017,553551840428949504,A lot of shifting sands in the coverage right now. We'll know soon enough.,Absolutly right.,charliehebdo,comment
74,500287202124103680,500286058664579072,Update: Ferguson police release stills from convenience store footage showing robbery,oh well that just justifies everything doesn't it. HANDSUPdontshoot,ferguson,comment
75,544300001568911360,544297696308518912,"UPDATE:  people being held hostage in Sydney shop, Opera House evacuated after suspicious package found: reports",While Bashar al-Assad was killing over  people World Leaders just sat there twidling their thumbs. lslamicVolcano Eruption,sydneysiege,comment
76,500371968831787009,500371149713178625,In what world do you let a cop who killed someone leave town? Ferguson,"Ferguson Missouri, obvs.",ferguson,comment
77,553551562732470272,553549686129561600,UPDATE: Gunman in kosher grocery store is demanding the release of the suspects in CharlieHebdo shooting - Reports,"“RT_com: UPDATE: Gunman in kosher grocery store is demanding the release of the suspects in CharlieHebdo shooting"" &lt;-- :(",charliehebdo,comment
78,552834026948415488,552833028201144320,URGENT:  gunmen involved in deadly attack on CharlieHebdo - French interior minister Paris,"not men, not human, these are Zealots, the same beasts Mosses used in the murder of  scores of ten when back from the mountain.",charliehebdo,comment
79,500307074589659137,500303144429973508,".mmwlawtaos - Ferguson PD tried to justify probable cause, even st &amp; d shot, everything after = premeditated murder.",Probable cause for what? The alleged robbery that cop wasn't aware of (so it appears) or alleged assault of cop?,ferguson,comment
80,525060425184858112,None,,"The Canadian soldier killed in today's Ottawa shooting is Cpl. Nathan Cirillo, a family source told CNN. Live blog:",ottawashooting,support
81,553195335661912064,553184482241814530,"I am still confused as to why these ""highly trained"" individuals left their ID in the getaway car. CharlieHebdo",I suspect they were rather distracted. Can't think why...,charliehebdo,comment
82,500379240299122690,500377906305327104,"Ferguson PD charged HenryDavis w/ ""destruction of property"" for bleeding on their uniforms:",after they beat him.,ferguson,comment
83,553591773537513473,553590835850514433,"Hostage-taker in supermarket siege killed, reports say. ParisAttacks",good work ,charliehebdo,comment
84,544382892378714113,None,,Five Hostages Escape Sydney Cafe Siege — Live Updates From,sydneysiege,support
85,500321053197864961,500320401369870336,"they've systematically only released information that makes them look good, even info that might taint",What other info do they have ready to release? All they have said is this is why we approached him.,ferguson,deny
86,499368327530414080,499366666300846081,Line of police cars with high beams on greets anyone trying to enter Ferguson. It's shut down. No media allowed.,Yeah Land of the Free My A%&amp;,ferguson,comment
87,544320115647741952,544319832486064128,"Hostage situation erupts in Sydney cafe, Australian prime minister says it may be ""politically motivated""","RT Hostage situation erupts in Sydney cafe, Australian prime minister says it may be “politically motivated”",sydneysiege,support
88,500340654841798656,500327120770301952,How many white celebrities have been CAUGHT shoplifting and end up dead in streets? I'll wait. Ferguson,“zellieimani: How many white celebrities have been CAUGHT shoplifting and end up dead in streets? I'll wait. Ferguson” truth,ferguson,comment
89,544354628775600128,544326091519700992,"“mashable: Uber says it has hiked prices in Sydney to ""encourage more drivers to come online &amp; pick up SydneySiege” Uber=ugly opportunism!","""Grease my palm with silver lovie."" The disgraceful pricks. Run 'em outta town folks.",sydneysiege,deny
90,544282786039726080,544278985249550337,Geoblock lifted on ABCNews. Streaming coverage of the Martin Place siege in Sydney here,"Yes. This is what real news is about: “mscott: Geoblock lifted on ABCNews. Streaming coverage of the Martin Place siege in Sydney...""",sydneysiege,comment
91,544292185722851329,544288681021145090,Up to  held hostage in Sydney Lindt Cafe siege,"Sick. ""Independent: Up to  held hostage in Sydney Lindt Cafe siege",sydneysiege,support
92,525061909968478208,525060425184858112,"The Canadian soldier killed in today's Ottawa shooting is Cpl. Nathan Cirillo, a family source told CNN. Live blog:",RIP,ottawashooting,support
93,499693411130429443,499691687326007296,"I don't believe that was his ""point"" at all.",Uh Sorry. I believe it was his point. Sharpton and Jesse remain silent on Chicago crimes happening daily.,ferguson,support
94,553584470264410113,553573995858382849,BREAKING: Gunman at kosher grocery store threatens to kill hostages if police storm terrorist brothers,where's Eddy Caplan when you need him,charliehebdo,comment
95,544518918912495616,544518335019229184,BREAKING: At least two people have died following the SydneySiege.  people are being treated by paramedics.,,sydneysiege,comment
96,544530369312477184,544515538383564801,"Haron Monis,Hostage-taker in Sydney: Fled Iran ,suspect in ex-wife killing, sex assaults",No wonder dude upped his game. Seems like men engaged in femicide &amp; sexual assaults in Australia can roam freely?,sydneysiege,comment
97,544478273238212608,544477183851630592,Just shoot him! Marksman have clearly had enough opportunities to do so,They don't know whether or not he has a booby trapped bomb attached to his person. EasyToCriticise,sydneysiege,comment
98,499596317413621760,499570907602767872,MikeBrown would need to be shot in Benghazi for foxnews to cover it,"or be white. Or old and white. Or an old, rich and white Senator.",ferguson,comment
99,500308482676240384,500308366561124352,BAM ANTI-WHITES get caught with their foot in their mouth in front of the WORLD LMAO,anti-whites ? lulz,ferguson,comment
100,500295446578085889,500294803402137600,Photos of alleged robbery involving Michael Brown in Ferguson (via police),Here's a petition to stop militarization of police departments,ferguson,comment
101,524946868887756801,524944399890124801,Recap: Gunman shot dead inside Parliament buildings; police believe there may be others on loose. Cdn soldier shot earlier at War Memorial.,Ottawa MT Gunman shot dead inside Parliament; police believe there may be others on loose. Soldier shot earlier at War Memorial,ottawashooting,comment
102,544392471007227904,544391176137089024,"Hostage taker in Sydney cafe demands ISIS flag and call with Australian PM, Sky News reports. sydneysiege","“cnni: Hostage taker in Sydney cafe demands ISIS flag and call with Australian PM, Sky News reports. sydneysiege”",sydneysiege,support
103,500382019109810176,500371149713178625,In what world do you let a cop who killed someone leave town? Ferguson,"in Egypt, they killed 's and still free",ferguson,deny
104,524978385660153856,524977952640221184,at least your polite self absorbed person.,"So now you judge me for  fucking RT with comment, one. Why don't you look at yourself in the mirror and judge that instead",ottawashooting,comment
105,553467311261503488,None,,Reports of shooting at Dammartin en Goele on route N north east of Paris - French media says car chase under way,charliehebdo,support
106,544314667795873792,544314008980172800,how do we know the guy isn't just pissed that he got fired or foreclosed on. Or his gf is cheating on him.,We don't.,sydneysiege,comment
107,552814805456027648,552811386259386370,At least  dead in the Paris shooting. Updated story and background info: CharlieHebdo,More madness - tragic: “WSJ: At least  dead in the Paris shooting.http://t.co/xESRZWpb CharlieHebdo,charliehebdo,comment
108,524970687803715584,524970281379823616,"Call me bad Canuck, I hope those fucktards get their asses kicked.",And I know they will too :) stupidattack,ottawashooting,comment
109,500303431928922113,None,,"Reminder: Forget the robbery, forget the minor looting. NOTHING justifies militarized police pointing sniper rifles at journalists Ferguson",ferguson,comment
110,553213579672178689,553212962044149761,Paris says highest alert level extended north to region where attack suspects spotted -,How stupid,charliehebdo,query
111,524958146343624704,524957372369108993,I had confirmed the first gunman was dead when I tweeted.,I had heard the same before I saw you &amp; many others tweet.,ottawashooting,support
112,553535342049902592,553461741917863936,Rural region of northern France searched in hunt for CharlieHebdo gunmen - latest updates,,charliehebdo,comment
113,553550482925715458,553550000584540160,StopKillingInnocentPeople FreePalestine freeBurma FreeSyria FreeKashmir,Right a tradgedy happening in France and you post this. This is the reason the world hates Islam.,charliehebdo,comment
114,500288302100918272,500286058664579072,Update: Ferguson police release stills from convenience store footage showing robbery,Waiting to see an outpouring of sympathy for the owner of the store that was attacked. Not holding my breath.,ferguson,comment
115,525036307173879808,524995771587108864,This afternoon we've lowered our flags to half mast in honour of the Canadian Reservist who lost his life in Ottawa.,The flags are also at half-mast. RIP Cpl. Nathan Cirillo. Our thoughts and prayers are with his family &amp; CAF,ottawashooting,comment
116,544302024352092162,544301453717041152,BREAKING UPDATE: Gunman says four devices are located around Sydney. Security response underway. Police calling for calm. News,oh cock,sydneysiege,comment
