,id,parent_id,parent_tweet,tweet,topic,classification
2140,500327622954717184,500327120770301952,How many white celebrities have been CAUGHT shoplifting and end up dead in streets? I'll wait. Ferguson,"*raises hand* Oooh Oooh I know, I know!....Um, none.",ferguson,comment
2141,525057109910495232,525056576038518785,Soldier killed in Canada shooting was a young reservist with a six-year-old son,Fuck Islam.,ottawashooting,deny
2142,553503611104542720,553502087661645824,rubbish! Martyrs don't run away they should have faced consequences immediately.,so if they’d stayed at the scene they would have been martyrs?,charliehebdo,comment
2143,544348496728309760,544348100165263360,Faster backflip than Tony Abbott!,at least they're righting a wrong. I'll grant them that.,sydneysiege,comment
2144,525009403658129408,525003468659228672,These are not timid colours; soldiers back guarding Tomb of Unknown Soldier after today's shooting StandforCanada,,ottawashooting,comment
2145,552826438798172160,552792980658987009,"“cnni: At least  killed in shooting at French satirical newspaper Charlie Hebdo, Paris prosecutor's office says.",Sad sad day,charliehebdo,comment
2146,544520373715222528,544520273718812672,Police confirm that sydneysiege is finally over. Two people reportedly injured after suffering gunshot wounds,oh my god,sydneysiege,comment
2147,544303487698210817,544302536803745792,whats going on,isis stuff,sydneysiege,comment
2148,552988724288827395,552978099357237248,"Most compelling image I've seen to come out of horrifying events in Paris, courtesy of Banksy. JeSuisCharlie","+ | : ""Most compelling image I've seen to come out of horrifying events in Paris, courtesy of Banksy.",charliehebdo,support
2149,553592233354870785,553590835850514433,"Hostage-taker in supermarket siege killed, reports say. ParisAttacks",I thought there was two hostage takers?,charliehebdo,query
2150,524974795503726593,524973817219653633,"are you middle eastern, by chance?",I am a proud Canadian afghan &amp; I support Canada's presence in Afghanistan,ottawashooting,comment
2151,552848723001475073,552848620375261184,Witnesses say the Charlie Hebdo gunmen identified themselves as members of al-Qaida:,I strongly condemn this terrorist attack as a Turkish Muslim.Terrorists Cannot represent Islam notinmyname,charliehebdo,comment
2152,525022402217271296,525019752507658240,"ISIS Media account posts picture claiming to be Michael Zehaf-Bibeau, dead OttawaShooting suspect. Canada",Could you tell us your source please?,ottawashooting,query
2153,500390975819513856,500389488217309184,Ferguson chief let most of day go by b disclosing (after repeated Qs) that cop who killed MikeBrown knew nothing about robbery. DANGER,Ferguson Chief needs to be removed from his job...I never meant  this  happen..don't insult our intelligence,ferguson,support
2154,553255878628237313,553152395371630592,This widely shared cartoon about the CharlieHebdo attack is actually by and not Banksy,,charliehebdo,comment
2155,524994741180846080,524993533212897281,"FBI assisting in the case of the Ottawa shooting, sources have confirmed to CTV News",thankfully the FBI is really good with lots of resources,ottawashooting,comment
2156,524960933211168770,524959809402331137,Senior U.S. official: Canadian government has informed U.S. that one shooter is dead in Ottawa. Live blog:,Replies  this English post really need to be in English. Especially when the world is assuming this is yet another act of terror.,ottawashooting,deny
2157,500328018087514112,500327106824245249,"All weekend ppl will be talking about the ""robbery"" instead of the shooting bc Ferguson PD didn't release any info about the shooting.",dm,ferguson,comment
2158,552820677338595328,552820213129809921,I feel that the intellectual level of this discourse has kinda gone to hell,easy just accept the truth and accept. You see abuse people not religion any where in the world. All religions,charliehebdo,comment
2159,524925341316689920,524925050739490816,BREAKING NEWS: Soldier shot at National War Memorial in Ottawa, why!!!,ottawashooting,query
2160,500320401369870336,500318794862960640,Not releasing facts about that shooting is also a way to make sure they get good info from witnesses.,"they've systematically only released information that makes them look good, even info that might taint",ferguson,support
2161,552824657028874241,552814494381256704,UPDATE: CharlieHebdo's editor-in-chief was killed in attack - Magazine's lawyer,,charliehebdo,comment
2162,524948946360483840,524947867975561216,"Ottawa Police Service: There were ""numerous gunmen"" at the Canada War Memorial shooting. One person was shot.",Ottawa was always such a safe city. This is madness.,ottawashooting,comment
2163,500305055351070722,500295393301647360,The other day I asked a manager at the Ferguson Market if police had requested surveillance video. She said no.,SIGN AND SHARE Ferguson JusticeForMikeBrown,ferguson,comment
2164,552836538875531265,552811386259386370,At least  dead in the Paris shooting. Updated story and background info: CharlieHebdo,omg!!!,charliehebdo,support
2165,500417601109889024,500391222075076610,"Store owner told Monday that there was a theft, but said it was not MichaelBrown; said it was someone else Ferguson",This is getting stranger by the minute. Will we ever get to the truth?,ferguson,comment
2166,544277362368843777,544277161985585152,The cafe is in the central business district of Sydney. Right across from Channel  news head office.,still extremely confusing. Why a CAFE in AUSTRALIA. It doesn't make sense,sydneysiege,query
2167,544358949399851008,544358564484378624,Police: Negotiators are now in contact with armed hostage-taker in Sydney situation; motive remains unknown -,RT Police: Negotiators are now in contact w/ armed hostage-taker in Sydney situation; motive remains unknown -,sydneysiege,support
2168,525060901137702913,525060425184858112,"The Canadian soldier killed in today's Ottawa shooting is Cpl. Nathan Cirillo, a family source told CNN. Live blog:",RIP Bro,ottawashooting,comment
2169,524943686032175104,524943490887991296,"CONFIRMED |  shooter shot dead at Parliament Hill, but there is more than  suspect. cbcOTT OTTnews","“CBCOttawa: CONFIRMED |  shooter shot dead at Parliament Hill, but there is more than  suspect. cbcOTT OTTnews” staysafeottawa",ottawashooting,comment
2170,553187846035873793,553164985460068352,The CharlieHebdo attack suspects have reportedly fired shots while robbing a petrol station,"""SkyNews: The CharlieHebdo attack suspects have reportedly fired shots while robbing a petrol station Thieves",charliehebdo,support
2171,524927041599447040,524926393394933760,"I know I can't be insightful yet - that's the bloody point, neither can you, and by trying to, you lose ground.",Give it one hour and my points will be confirmed.,ottawashooting,comment
2172,544337321349230592,544306719686656000,"US evacuated Consulate in Sydney after sydneysiege. Emergency warning to U.S. citizens urging them to ""maintain high level of vigilance"".",maintain high level of vigilance? Against who? Obama said islamic terrorists don't exist in America remember?,sydneysiege,query
2173,544297924088582144,544288681021145090,Up to  held hostage in Sydney Lindt Cafe siege,"Get the terrorists families, take them to the cafe. Surrender or your families will be shot in front of you. Eye for an eye.",sydneysiege,comment
2174,524958112629809152,524956129017995264,"Police say shots fired at  Ottawa sites - National War Memorial, Parliament Hill, and now Rideau shopping centre",police is quite lazy.,ottawashooting,deny
2175,500292158344417280,500291010010701825,.AlwaysThinkHow - Barney Fife would have tried to pull MikeBrown through a window too. Shades of Ernest T. Bass Ferguson,"Agreed, Dante!",ferguson,comment
2176,521368262010224640,521360486387175424,AC Milan midfielder Michael Essien has been diagnosed with Ebola. Get well soon Michael. [Daily Times],“FutbolLife: AC Milan midfielder Michael Essien has been diagnosed with Ebola. Get well soon Michael. [Daily Times],ebola-essien,support
2177,524943557657133056,524941702046707712,I'm a Photo Editor ABC- Would you be willing to share this with all ABC News platforms and with partners if we credit?,"Yeah, sure. Please credit me though.",ottawashooting,comment
2178,524990987308134400,524962247563431936,"exactly, because they are ""journalists"" and ""dems the rules"" Kelly is a ""comedic writer"" no rules. Go police journalists","No, you're right. We should follow comedic writers and trust their sources. That's my first instinct.",ottawashooting,comment
2179,500355274352234496,500354773133299713,"In , Ferguson police beat a man and charged him for bleeding on them:","Kanye would do this “ComplexMag: In , Ferguson police beat a man and charged him for bleeding on them.",ferguson,comment
2180,544345742664822784,544333222801186816,when it started to appear on M$M the narrative was the same. ..Like say a Script..I mean 'goverMENt press release ..fishy..:(,You two should get together and have the world's stupidest baby.,sydneysiege,comment
2181,524926344992686081,524926235030589440,BREAKING NEWS: At least  shots fired at Ottawa War Memorial. One soldier confirmed shot -,"Gee, I thought Canadians are supposed to be polite for once....",ottawashooting,comment
2182,524993716336197632,524930977211355136,You're an idiot.,", I guess your a fan of the fascist Stevie and his band of crap , so that tells me what you are !",ottawashooting,comment
2183,544384226855227394,544384019857960961,Better than the cretins posting selfies from the same area,seconded,sydneysiege,comment
2184,544290890370777088,544290571280338948,So sorry &amp; fear for the hostages,yeah i bet its awful,sydneysiege,comment
2185,552803445711708160,552802654641225728,Charlie Hebdo shooting latest:  dead and gunmen still at large,Dua belas. RT Charlie Hebdo shooting latest:  dead and gunmen still at large,charliehebdo,support
2186,553521356378476544,553518472798683136,MORE: Official: French terror suspects want to be martyrs; are holed up with hostage north of Paris:,"capture them, shave them, and march them through the streets of Paris like WWII collaborators. JeSuisCharlie Cowards",charliehebdo,comment
2187,552845552770351105,552808282440859648,the real problem was letting these moooslims into the free world.ask politicans why we need them .moohammadd bedded MR.ED,u imposed dictators stole raw material both in africa and middle east,charliehebdo,comment
2188,544470819057852416,544469733488074752,“onewaymule: I'm fascinated by Ray Hadley's role in sydneysiege. Genuine intermediary or opportunistic blowhard?” Door B,err Typhoon Hadley an intermediary???? lol collapses on floor with laughter......,sydneysiege,comment
2189,553891758271369216,553198499891007488,Showing his face in his final moments is crass insensitivity and totally unnecessary - his family are grieving,"Well said, I agree.",charliehebdo,support
2190,544534380614807552,544291804057960448,FIRST PHOTOS: Hostage pressed against a window. SydneySiege,CAUTION Be aware that this could be a FalseFlag Event unfolding right across the street from channel  coincidence? Perhaps,sydneysiege,support
2191,500278685698519041,500278045597368320,URGENT: Darren Wilson is the police officer who shot Mike Brown Ferguson,"Micheal Brown was a hardened criminal. But , of course, shooting him was wrong and the cop should get the death penalty",ferguson,comment
2192,500371514127310850,500369339628126209,"that being said, even if he committed the most awful crime on planet earth, he DID surrender. No reason to be shot.",no need to thank im with u that stealing a cnt cigar shouldnt trump a kid who had a future. We all do stupid shit,ferguson,comment
2193,544281098906521600,544278985249550337,Geoblock lifted on ABCNews. Streaming coverage of the Martin Place siege in Sydney here,still does not work in uk,sydneysiege,comment
2194,500313330930966529,500270780832174080,Police in Ferguson plan to release name of officer who shot unarmed teen Michael Brown:,that is a really stupid announcement by the Ferguson police,ferguson,comment
2195,524991671218745344,524991576163250176,MORE: Police believe three gunmen were involved in shootings in Ottawa this morning and are looking for two shooters.,"Lies and propaganda are traditionally the tools of theocracy, fascism, and totalitarianism. Stop build terrorism &amp; Isis's fame!",ottawashooting,comment
2196,553509397063041024,553506608203169792,"Map shows industrial estate where  CharlieHebdo suspects are holed up, surrounded by police",,charliehebdo,support
2197,544348986484613120,544333288249118720,What do you pay your drivers?,"Uber is covering the cost of all rides, Uber is still paying drivers higher fares to encourage them to pickup riders.",sydneysiege,support
2198,553540999465926657,553539730449924096,"Pray for hostages RT Shooting, hostage-taking at kosher market in Paris; several reported wounded:","RT“Daroff: Pray for hostages RT Shooting, hostage-taking at kosher market in Paris; several reported wounded:",charliehebdo,comment
2199,553153997226663936,553152395371630592,This widely shared cartoon about the CharlieHebdo attack is actually by and not Banksy,Love this !,charliehebdo,comment
2200,500274739537924096,500270780832174080,Police in Ferguson plan to release name of officer who shot unarmed teen Michael Brown:,they don't have a choice under MO law,ferguson,comment
2201,500289681062248451,500288349924782080,Did anyone think of comparing the clothes that MikeBrown was wearing when he was laying on the street to the security footage? Ferguson,,ferguson,deny
2202,544559045307142144,544557233455910913,Muslims are a problem all around the world and your statement is false and a lie.,I was trying to enlighten you on what a Muslim and Islam is cos you seemed so ignorant! Blame d person not religion,sydneysiege,comment
2203,525007688405491712,525007273832497154,Not a hoax. This is before the shooting,"It's not a hoax, but it also wasn't taken *after* the shooting.",ottawashooting,comment
2204,544340358717382656,544339757195489281,"You called uber public transport, it's not. PT is for everyone not just the elite.","I never called uber PT. Everyone is having a go at Uber but not PT... We own it,we shouldn't have to pay in desperate times",sydneysiege,deny
2205,552811835057909761,552810448324943872,"CHARLIEHEBDO SHOOTING: Gunmen shouted 'we have avenged the prophet"" during attack - reports",ISLAMIC SCHOLARS SHOULD COME FORWARD TO END 'JIHAD' ! IT IS INHUMAN &amp; WOULD DESTROY THE CREDIBILITY OF ISLAM !,charliehebdo,support
2206,525034548196024320,525034442104901632,If Michael Zehaf-Bebeau had his passport confiscated doesn't it make sense to track his movements - was this done?,"yes, but CSIS can't watch that many /",ottawashooting,query
2207,544273614229733377,544272856528715776,"More on situation at Martin Place in Sydney, AU",yeah. That's her station,sydneysiege,comment
2208,544277466639257601,544271362022338560,"Black Islamic flag being held up in window of lindt chocolate store in Martin Place, Sydney - hostages inside.",Get the snipers out and exterminate,sydneysiege,comment
2209,552792826216329217,552791578893619200,Eleven dead in shooting at Paris offices of satirical magazine Charlie Hebdo – live updates,Shit ...“guardian: Eleven dead in shooting at Paris offices of satirical magazine Charlie Hebdo – live updates,charliehebdo,comment
2210,524943172875845632,524923462398513152,Shots fired on parliament hill after a man walked up with a gun. I'm locked in a security office on parliament hill,stay safe Cormac.,ottawashooting,comment
2211,524995771587108864,None,,This afternoon we've lowered our flags to half mast in honour of the Canadian Reservist who lost his life in Ottawa.,ottawashooting,support
2212,500415275884244992,500404172140085248,I see. These guys are like the  Stooges,"Which is an insult to the Three Stooges, but I agree with your point hundred percent.ronzell",ferguson,support
2213,552979530923925504,552978184413921281,Banksy's take on CharlieHebdo. JeSuisCharlie NousSommesCharlie,Banksy gets it right. “juliamacfarlane: Banksy's take on CharlieHebdo. JeSuisCharlie NousSommesCharlie,charliehebdo,support
2214,553196247319064576,553184482241814530,"I am still confused as to why these ""highly trained"" individuals left their ID in the getaway car. CharlieHebdo",how about the story that friends of the third suspect Hamyd saw him in class km away during the attack,charliehebdo,comment
2215,544298040652099584,544288681021145090,Up to  held hostage in Sydney Lindt Cafe siege,“Independent: Up to  held hostage in Sydney Lindt Cafe siege,sydneysiege,support
2216,544287443407892480,544282661909323776,"And that time is now, they have brought it to us, they'll be sorry","just watching here Hun, shocking news x",sydneysiege,comment
2217,500283123532570624,500280838710247424,"Police reports released this morning indicate Mike Brown was a suspect in a ""strong-armed"" robbery in Ferguson","wait a min, I thought they said he was a good boy?",ferguson,comment
2218,552811728447078400,552808637719408641,islam is not a religion its a brainwashed cult.,hehehe yah like Judaism Christianity and worst hinduism. This is what fools in churches call it. Because they are afraid,charliehebdo,comment
2219,544322790329835521,544319274072817664,"Ray Hadley says he spoke with hostage, and could hear the gunman in the background barking orders and demanding to go live on air",prefer to listen to Hadley than the terrorist deniers at their ABC,sydneysiege,comment
2220,500382947229581312,500363126294863876,The Ferguson police chief just basically confirmed MikeBrown was gunned to death for the crime of walking in the street? Horrific.,no they did not,ferguson,deny
2221,553587214987558912,553586860334010368,CharlieHebdo killers shot dead by police,you the fastest for breaking news...,charliehebdo,support
2222,544406663898624000,544401782676680704,"Police confirm they are ""monitoring Facebook &amp; Twitter"" after reports hostages are tweeting from inside sydneysiege","how irresponsible tweeting this info, putting innocent lives in jeopardy for a story..shame on you BBC",sydneysiege,comment
2223,499372044593930240,499366666300846081,Line of police cars with high beams on greets anyone trying to enter Ferguson. It's shut down. No media allowed.,is this photo from last night?? Please clarify because you are using present tense.,ferguson,query
2224,524926357927903232,524925050739490816,BREAKING NEWS: Soldier shot at National War Memorial in Ottawa,Bizar..Gister Montréal vandaag Ottawa. BREAKING NEWS: Soldier shot at National War Memorial in Ottawa,ottawashooting,comment
2225,544333004928057345,544332606280437760,;) Hey Aussie Sheeple wanna invade the middle east because of one wack job...:,IT'S AN OLD TIRED STORY!!! WE GOTTA NIP THIS IN THE BUD!,sydneysiege,comment
2226,500357587997831169,500356909816631296,to make him look like the bad guy.. Since there is no real reason for why they did it.,It was to show his mentality. To prove that he isn't as innocent as anyone thought he was.,ferguson,comment
2227,521352678283444224,521346721226711040,Unconfirmed reports claim that Michael Essien has contracted Ebola.,“FootballcomEN: Unconfirmed reports claim that Michael Essien has contracted Ebola.,ebola-essien,comment
2228,524959988956291074,524959809402331137,Senior U.S. official: Canadian government has informed U.S. that one shooter is dead in Ottawa. Live blog:,War Memorial Soldier pronounced dead just now.,ottawashooting,support
2229,553591453675696129,553590459688570880,Several hostages freed at Jewish supermarket in Paris. Photo Thomas Samson AFP,MOOI. “AFPphoto: Several hostages freed at Jewish supermarket in Paris. Photo Thomas Samson AFP,charliehebdo,support
2230,553587865351753730,553587353437356032,".marrty -SO SAVE ME THE FUCKING LECTURE, AND WHEN MY FELLOW TRIBE MEMBERS ARE BEING HELD HOSTAGE, DONT DARE TELL ME TO CALM DOWN.",And the hostages at the kosher market have been freed. Happy for you David.,charliehebdo,comment
2231,524946767209459712,524944399890124801,Recap: Gunman shot dead inside Parliament buildings; police believe there may be others on loose. Cdn soldier shot earlier at War Memorial.,"RT ""CBCAlerts: Gunman shot dead inside Parliament; police believe there may be others on loose. Cdn soldier shot earlier at War Memorial.”",ottawashooting,comment
2232,499570907602767872,499368931367608320,"Currently the FoxNews website has zero, repeat, ZERO coverage of the Ferguson protests, probably due to lack of cowboy hats.",MikeBrown would need to be shot in Benghazi for foxnews to cover it,ferguson,comment
2233,500295655458230272,500294803402137600,Photos of alleged robbery involving Michael Brown in Ferguson (via police),Is robbery a death penalty in MO? and without a trial?,ferguson,comment
2234,524972964052103169,524972665564835841,I can't believe people focus on stupidity instead of real problems.,these extremist infidels are the problem not our Govt,ottawashooting,comment
2235,553585746754682880,553579224402235393,"Hostage-taker at Paris store demands release of KouachiBrothers, police union spokesman says.",Hostage-taker at Paris store demands release of Kouachis police union spoke says. via,charliehebdo,support
2236,544516094133035008,544514570367168512,SydneySiege: Latest video of hostages escaping.,"Boil him in pig fat, I.e. Lard.",sydneysiege,comment
2237,544293930087366657,544292691928838144,.SharriMarkson Your stupidity is beyond belief. Just stop if you are capable of that.,She is SOOOOO Stupid that she is completely incapable of realising it.,sydneysiege,comment
2238,500367139652784128,500366747506335744,yeah they faked the video LOLyour racist denial,“PublicOffendor: yeah they faked the video LOLyour racist denial” oh please,ferguson,comment
2239,544514838509006849,544512910538838016,"UPDATE: Hostages fleeing Sydney cafe held by Iranian gunman as explosions, gunshots are heard:","Was he saying ""hands up don't shoot""? Police overreaction? People are glad the police are there when they are in trouble.",sydneysiege,query
2240,544384788527083521,544381485591982083,Reports on sydneysiege gunman wants ISIL flag delivered to cafe and he also wants to speak to PM or people will be killed.,Deliver him the Australian SAS instead.,sydneysiege,comment
2241,500290490382942209,500290256928014336,"YES, it was JUSTIFIED",you're one sick racist bitch,ferguson,comment
2242,525011846164938752,524977699584897024,"perhaps, Trudeau is not that change. He's out of touch with most Canadians, he's not ready to run this country.",if you remember americans Said the same about but he turned out to be a good leader despite all his critics,ottawashooting,deny
2243,553555102423089152,553549686129561600,UPDATE: Gunman in kosher grocery store is demanding the release of the suspects in CharlieHebdo shooting - Reports,"Yeah, that's going to happen! MT Gunman in kosher grocery store is demanding the release of the suspects in CharlieHebdo shooting",charliehebdo,support
2244,500315038541156352,500307001629745152,It appears that Ferguson PD are trying to assassinate Mike Brown's character after literally assassinating Mike Brown.,"I'm curious, had the suspect been white would the PD have acted the same?",ferguson,comment
2245,544296446368169984,544296176892116993,probably the layout of the building. Public place. Easy media coverage,true. Seems it's well executed,sydneysiege,support
2246,553573926786580480,553555326125895680,"Well, that's a good idea too. But...they're gonna end up life in prison and that means that they're gonna live on taxes...",French taxes... But the French don't treat prisoners as well as we do,charliehebdo,deny
2247,499586042752557056,499368931367608320,"Currently the FoxNews website has zero, repeat, ZERO coverage of the Ferguson protests, probably due to lack of cowboy hats.",Imagine if Ferguson folks were strutting around with AR's. Think Perry&amp;Hannity would be hunkered down in solidarity?,ferguson,support
2248,500291870736412672,500290456845299714,Here's the police report. Somehow Ferguson cops valued a box of Swishers at nearly $. Time to stop smokin I guess,Could've been a  count box which are ~$. Box like this:,ferguson,comment
2249,525040562765053952,525032872647065600,"BREAKING: Michael Zehaf-Bebeau had been designated ""high-risk traveller"" by CDN govt, which confiscated his passport",the incident yesterday (car) in Canada was that a terrorist attack as well?,ottawashooting,support
2250,544322700726906880,544289941996326912,Prime Minister Tony Abbott's statement on the SydneySiege. Updates:,Prime ministers should not have to comment on everything.,sydneysiege,deny
2251,553522189337890816,553507495604678658,You telling me that in a km motorway car chase involving a Peugeot  they couldn't be taken out?? Pathetic!!!,coppers don't want to kill them.,charliehebdo,comment
2252,552810626503176192,552810448324943872,"CHARLIEHEBDO SHOOTING: Gunmen shouted 'we have avenged the prophet"" during attack - reports",sounds like a sketch from family guy,charliehebdo,support
2253,500259232764411904,500258409988763649,"Name of Ferguson cop is expected to be released by  ET, police chief says: (J.B. Forbes, AP)",BTW the interview the Ferguson Police Chief conducted yesterday was the worst interview I have ever seen,ferguson,comment
2254,544385543342014464,544381485591982083,Reports on sydneysiege gunman wants ISIL flag delivered to cafe and he also wants to speak to PM or people will be killed.,take the shot...snipertime,sydneysiege,support
2255,544293240669622272,544291965513134080,"According to Seven, this is a picture of the gunman",looks like a little green man!,sydneysiege,comment
