,id,parent_id,parent_tweet,tweet,topic,classification
3092,553535440821575682,553534838880608256,BREAKING Gunman in policewoman killing suspected in new Paris hostage-taking: source,Vincennes Montrouge RT “AFP: BREAKING Gunman in policewoman killing suspected in new Paris hostage-taking: source”,charliehebdo,comment
3093,524926127174078464,524925215235911680,BREAKING news: Shots fired at Parliament Hill. Follow developing story:,“globeandmail: BREAKING news: Shots fired at Parliament Hill.,ottawashooting,comment
3094,544419950816161792,544358533819420672,BREAKING: Three hostages appear to have escaped the Sydney cafe where a siege remains ongoing. sydneyseige,,sydneysiege,deny
3095,501714124771168257,501667615350083584,Max are you listening to what the Chief of Police said or do you just want to believe lies? Listen carefully,Don't understand your argument - we're both on same side. Was repeating what Dorian said. Also Chief walked stmt back later,ferguson,comment
3096,576813541736517634,576812998418939904,Putin reappears on television amid rumours his 'girlfriend' is about  give birth,Mazaltov! They could call the baby Ukrainia.,putinmissing,support
3097,552808456894169089,552806494283251712,insulting others people faith cannot be called freedom of speech. Chief editor is one to blame. I Do not justify monsters-jail them,satire. Get it? Insults r free speech. Cowardice &amp; murder r not. Islamic terror is celebrated by its followers,charliehebdo,comment
3098,553590981967511553,553590459688570880,Several hostages freed at Jewish supermarket in Paris. Photo Thomas Samson AFP,“AFPphoto: Several hostages freed at Jewish supermarket in Paris. Photo Thomas Samson AFP,charliehebdo,support
3099,552837270953529345,552834961762709505,Paris Manhunt:  CharlieHebdo attackers with AK- rifles &amp; reportedly rocket-propelled grenade still at large,"islam is a barbaric heinous ""religion"" I can't recall  good thing it has contributed to anyone. It's a violent cult, nothing more.",charliehebdo,comment
3100,500313282184761344,500301270532370433,"- Even if not innocent, no justification for violating rights, removing due process &amp; execution Ferguson MURDER!",Robbers do not just stroll down the middle of the street after robbing a store. IDIOTS Ferguson,ferguson,comment
3101,544358641772806144,544358533819420672,BREAKING: Three hostages appear to have escaped the Sydney cafe where a siege remains ongoing. sydneyseige,For Only $ You Can Buy K Followers,sydneysiege,comment
3102,524931726699954178,524929497205055488,Canada's Parliament Hill is on lockdown as police hunt shooting suspect; at least  injured -,“BreakingNews: Canada's Parliament Hill is on lockdown as police hunt shooting suspect; at least  injured O.O,ottawashooting,support
3103,553552954297692160,553549946738446336,Hashtag kosher shows lots of journalists are referring to it as a kosher supermarket.,that's my mistake. Thanks!,charliehebdo,comment
3104,553580063586000896,553579224402235393,"Hostage-taker at Paris store demands release of KouachiBrothers, police union spokesman says.","I don't think he understands, kidnappers surrender or get shot, murderers surrender or get shot. It's quite simple ! JeSuisCharlie",charliehebdo,comment
3105,553508438224142336,553506608203169792,"Map shows industrial estate where  CharlieHebdo suspects are holed up, surrounded by police",Stick a scaffolding pole up their arses and set it in the ground with a camera on their faces to live-stream them slowly dying,charliehebdo,comment
3106,544386758662565888,544385083574996992,haha getting your news from  is like watching Looney Tunes for Social skills ha MartinPlace,"&amp; really an ISIL flag? Surely when packing his shot gun, that would be the first item he'd pack!",sydneysiege,deny
3107,525060679272001537,525060425184858112,"The Canadian soldier killed in today's Ottawa shooting is Cpl. Nathan Cirillo, a family source told CNN. Live blog:",This is FAR from breaking news.... this has been known for hours,ottawashooting,comment
3108,500313191524466692,500311804518871040,But they have had six days to come up with a narrative though!,".coreybking - No narrative will justify actions after the d shot, MikeBrown surrendered, cop kept firing",ferguson,comment
3109,529654399455727617,529654186791944192,Prince rumoured to be performing in surprise show in Toronto,I guess it's no longer a surprise.,prince-toronto,comment
3110,544321707436019712,544319274072817664,"Ray Hadley says he spoke with hostage, and could hear the gunman in the background barking orders and demanding to go live on air",is Ray prepared to go in wearing a wire?,sydneysiege,comment
3111,544395872067272704,544382368304214016,"FFS, she's been through enough without you plastering close ups of her face all over twitter. Leave her alone.",amen to that!!! Bloody media. Leave the poor girl alone.,sydneysiege,comment
3112,544278335455776769,None,,"BREAKING Hostages held inside Sydney cafe, Islamic flag held up",sydneysiege,support
3113,576514586087714817,576513463738109954,Putin reappears on TV amid claims he is unwell and under threat of coup,,putinmissing,comment
3114,524949399286579201,524947867975561216,"Ottawa Police Service: There were ""numerous gunmen"" at the Canada War Memorial shooting. One person was shot.",Ottawa police have NOT confirmed multiple shooters based on Canadian reporters on scene but they are still looking in case,ottawashooting,deny
3115,499452664053104642,499451011791335424,I know that's right..hoping to god Someone captured on phone +hasn't came forward -yet..(video/shooting),If we don't Jail these Rogue..Racist Cops they won't Stop Killing young Unarmed Black Men.. Sick,ferguson,comment
3116,544284949986439169,544283772569788416,Live Updates: Siege in Sydney Cafe,"“SkyNews: Live Updates: Siege in Sydney Cafe"" &gt; GUESS WHO....That's right MUSLIMS",sydneysiege,support
3117,499370418445508608,499368931367608320,"Currently the FoxNews website has zero, repeat, ZERO coverage of the Ferguson protests, probably due to lack of cowboy hats.","Na, it's too many black people for FoxNews to care",ferguson,query
3118,544300186554474497,544280339720728576,Any danger of leaving it off for good?? Expats are shut out by the ABC. Missing quality shows.,"you would have to talk to the content rights holders , they determine where ABC can allow their shows to be broadcast",sydneysiege,comment
3119,500371149713178625,None,,In what world do you let a cop who killed someone leave town? Ferguson,ferguson,support
3120,525026201103265792,525023449262333952,"BBC News - Mr Merizier said that the attacker was of ""Arabic appearance"" and had ""long dark hair and a beard"".",just a coincidence. Obviously a white angry racist,ottawashooting,comment
3121,544285405390983168,544282961118375936,fucking camel fuckers cowards picking on civilians,More Ammo to clean up militant Islamics inOzz No more pussyfooting Diggers Smack em down,sydneysiege,comment
3122,553154805905235968,553152395371630592,This widely shared cartoon about the CharlieHebdo attack is actually by and not Banksy,The pen/pencil truly is mightier than the sword!,charliehebdo,comment
3123,553167053742694400,553164985460068352,The CharlieHebdo attack suspects have reportedly fired shots while robbing a petrol station,little shits are just using religion to go around murdering innocent people because they are uneducated no-good thugs scumbags,charliehebdo,comment
3124,544301353976467457,544297696308518912,"UPDATE:  people being held hostage in Sydney shop, Opera House evacuated after suspicious package found: reports",only just decided to air this have you?? Jeez,sydneysiege,query
3125,553689869810409473,553505242554175489,"Suspects in CharlieHebdo attack spoke to police by phone and said they wanted to die as martyrs, says French MP.","That is what they really want, another way would be a shame for them.",charliehebdo,comment
3126,500363941114298368,500363420689248256,But... There was something leading up to the shooting? Or what?,“mamajeannielove: But... There was something leading up to the shooting? Or what?”-&gt; soon they'll say officer felt a gun onMike,ferguson,comment
3127,544280339720728576,544278985249550337,Geoblock lifted on ABCNews. Streaming coverage of the Martin Place siege in Sydney here,Any danger of leaving it off for good?? Expats are shut out by the ABC. Missing quality shows.,sydneysiege,query
3128,553567072114839553,553566026030272512,"Breaking: Two hostage situations in France are linked, Paris prosecutor says",Time to ban religion.,charliehebdo,comment
3129,552810884314443776,552791578893619200,Eleven dead in shooting at Paris offices of satirical magazine Charlie Hebdo – live updates,Appalling and so tragic. “guardian:  dead in shooting at Paris offices of satirical magazine Charlie Hebdo,charliehebdo,comment
3130,553479692133470209,553474188259102720,"BREAKING: Shots fired, hostages taken in manhunt for CharlieHebdo attackers, police say",,charliehebdo,comment
3131,544293730455269376,544292535565180928,if you can have a photo of this bloke then just snipe him in the head. GameOver,put a bullet in the wankers head,sydneysiege,comment
3132,500399685232623616,500397765881774080,"Hey everybody, robbed a store. Can they shoot you down? Can I say that after they shoot you down?",snitches get stitches in the hood. Store owner knows. blackdenial changeyourculture,ferguson,comment
3133,521351752734769152,521346721226711040,Unconfirmed reports claim that Michael Essien has contracted Ebola.,“FootballcomEN: Unconfirmed reports claim that Michael Essien has contracted Ebola. unconfirmed.....,ebola-essien,comment
3134,553549302187192320,553544252563935234,BREAKING: At least  killed in Paris hostage situation via,,charliehebdo,support
3135,553572054511779840,553571844562120704,I assume you mean niece?,yes,charliehebdo,comment
3136,500283003323842560,500280838710247424,"Police reports released this morning indicate Mike Brown was a suspect in a ""strong-armed"" robbery in Ferguson",Ironic since all the i witnesses say the officer was white. Now it is the black officer Darren Wilson who shot??,ferguson,query
3137,524956507230593026,524956129017995264,"Police say shots fired at  Ottawa sites - National War Memorial, Parliament Hill, and now Rideau shopping centre",Scary stuff in Ottawa,ottawashooting,deny
3138,524948866773184512,None,,Ottawa police issued a statement. Three separate shooting incidents. Once inside parliament. One at the war memorial. One at Rideau Centre,ottawashooting,support
3139,544351320174772224,544350712365207552,BREAKING Reports two customers and an employee have escaped the SydneySiege,here's to all the hostages getting safe passage on this day! SydneySeige,sydneysiege,support
3140,553596198956056576,553595330009518080,wonder if get the impression we are sick of these extremists and how the government just let them in,"it could never happen here, we don't have a paper with enough balls to publish anything that offends Muslims notPC",charliehebdo,comment
3141,544302387075100672,544301453717041152,BREAKING UPDATE: Gunman says four devices are located around Sydney. Security response underway. Police calling for calm. News,“PzFeed: UPDATE: Gunman says  devices are located around Sydney. Security response underway. Police calling for calm.” Sherlock!?!?,sydneysiege,comment
3142,544280000124694528,544271362022338560,"Black Islamic flag being held up in window of lindt chocolate store in Martin Place, Sydney - hostages inside.",so we still not sure of the motivation for the attack?,sydneysiege,query
3143,500308000901701632,500303431928922113,"Reminder: Forget the robbery, forget the minor looting. NOTHING justifies militarized police pointing sniper rifles at journalists Ferguson",minor looting? Didn't they burn down a store?,ferguson,query
3144,525020934265393152,525020658972258305,Which accounts?,Follow me please. I will DM you.,ottawashooting,comment
3145,500477494307618816,500371149713178625,In what world do you let a cop who killed someone leave town? Ferguson,I think you know the answer to that one.,ferguson,comment
3146,576321273594294272,576319832800555008,Hoppla! Swiss Rumors: Putin absence due to girlfriend Alina giving birth in Ticino,Mr Putin building the nation is great. Good country man and best president,putinmissing,comment
3147,524981867876212736,524980744658382848,"RCMP to hold news conference on Ottawa shootings at  pm ET,  am PT. Watch live coverage",,ottawashooting,comment
3148,544557233455910913,544465538882084864,"Extremist rather, no true Muslim will do such nonsense act! The world should know this by now...",Muslims are a problem all around the world and your statement is false and a lie.,sydneysiege,deny
3149,525554047408160768,524981436252950528,Canadian authorities have given name of suspect in Ottawa attacks to U.S. feds; ask for FBI assistance: Sr U.S. law enforcement official,Follow Official account,ottawashooting,comment
3150,524974938256457729,524974118614347776,exactly so why did you or your friend already pointed the fingers at Muslims ignorantmuch,"you did, you blamed our foreign policy to start with...",ottawashooting,comment
3151,552841806245679104,552840744210161664,Scary!  CharlieHebdo attackers with AK- rifles &amp; reportedly rocket-propelled grenade still at large,"Mam, Can I get DM from you with Mam's contact number for a telephonic reaction on News . Would really appreciate",charliehebdo,comment
3152,552785851655393281,552785375161499649,BREAKING:  reportedly shot dead at Paris HQ of French weekly Charlie Hebdo,How dreadful.,charliehebdo,support
3153,524922729485848576,None,,Only photo I will tweet. CPR being performed on the soldier now. I heard four shots. ottawa,ottawashooting,support
3154,500399226489434112,500398907415732227,I'm not arguing that he deserved to be shot.,Then what are you arguing?,ferguson,comment
3155,553008434627362816,553008182050947072,Islamaphobe,"not really, just pissed off. I'm against all religion.",charliehebdo,comment
3156,500308076004929537,None,,"Possible ""robbery"" took place and BAM! Like magic it's as if another UNARMED black youth being murdered has been forgotten smh Ferguson",ferguson,comment
3157,499367096875114497,499366666300846081,Line of police cars with high beams on greets anyone trying to enter Ferguson. It's shut down. No media allowed.,that's from last night. Not tonight.,ferguson,deny
3158,544331106581897216,544329935943237632,Uber Sydney trips from CBD will be free for riders. Higher rates are still in place to encourage drivers to get into the CBD.,who's paying then?,sydneysiege,query
3159,524927455715663872,524925215235911680,BREAKING news: Shots fired at Parliament Hill. Follow developing story:,I'm taking bets on how quick ISIS or Syria will be blamed. After all Syria is where the US want to bomb next.,ottawashooting,comment
3160,544302813615247360,544291804057960448,FIRST PHOTOS: Hostage pressed against a window. SydneySiege,“TheAnonMessage: FIRST PHOTOS: Hostage pressed against a window. SydneySiege SHIT,sydneysiege,comment
3161,525027625329508352,525025463648137216,BREAKING: A source confirms to CP that the deceased soldier in Ottawa is Cpl. Nathan Cirillo. Cirillo was a member of the Hamilton Argylls,RIP,ottawashooting,comment
3162,524989506509103105,524969201102901248,MPs credit sergeant-at-arms for saving lives in Parliament Hill shootings,Canada is telling the World that we are up to the task of defending !,ottawashooting,comment
3163,553232132269953024,553214496567590914,"THE TERRORIST MOST LIKELY FLED TO THE MUSLIM ZONE WHERE COPS ARE NOT ALLOWED, COULD HAPPEN IN AMERICA",It is a matter of when it will happen.,charliehebdo,comment
3164,544347216282791936,544330821365014529,so is uber paying for the rides paying the drivers?,Uber trips out of the CBD today are free to help Sydneysiders get home safely. See,sydneysiege,comment
3165,552795124288073729,552793899522355200,I strongly condemn this terrorist attack as a Turkish Muslim.I love my Prophet.But my Prophet rejects terrorism.,how do you know that the attackers were muslims?,charliehebdo,query
3166,525020495759282176,525014151161081856,"I agree Tyler, have some respect.That man shot is servicing your country and all you want to do is snap a pic.Pity you!",You have a phone! Did you call for help? Nope. I took pics to sell and tweeted that I'm on CNN and ABC.,ottawashooting,comment
3167,544289696915136512,544288822545354753,at least they've got good chocolate,you are an insensitive idiot!,sydneysiege,comment
3168,525019382490361856,524954074262011904,The Religion of Peace I am guessing.,u dumb fuck before u open ur mouth u should get ur fact ta straight.. isn't it funny that it was white guy?,ottawashooting,comment
3169,544286846780723200,544282661909323776,"And that time is now, they have brought it to us, they'll be sorry",Talk talk we need action toigh action.,sydneysiege,comment
3170,544452296550383616,544358533819420672,BREAKING: Three hostages appear to have escaped the Sydney cafe where a siege remains ongoing. sydneyseige,O Lord Save All Hostages in Sydney &amp; Turn Militants  Righteous Ways MSGTheFilm ,sydneysiege,comment
3171,500326334464544769,500319801344929795,"The day Ferguson cops told a dirty, bloody lie (via",Republican Rand Paul is speaking out STRONGLY against police brutality against blacks News,ferguson,comment
3172,500378522788315137,None,,Ferguson police: Officer involved in fatal shooting of Michael Brown didn't know he was suspect in alleged robbery.,ferguson,support
3173,552840094156349440,552821069036670976, CharlieHebdo cartoonists killed: - Charb - Cabu - Tignous - Georges Wolinski JeSuisCharlie,A SURGICAL INCISION,charliehebdo,comment
3174,544518182631768064,544517264054423552,BREAKING: Police have confirmed that the SydneySiege is over. News,THANK GOODNESS,sydneysiege,comment
3175,500281337694416896,500281131057811456,"BREAKING NEWS: According to documents released to the press, MikeBrown was connected to an earlier robbery Ferguson",that still is no excuse to kill him,ferguson,comment
3176,524994047451332608,524993526564929536,"seeing as though I was % correct, yes.",Kudos to your relaying of second-hand information! Do you have an app?,ottawashooting,query
3177,544280600610603008,544279546766180352,cant read arabic it could be anything More informed people tell me its a shadah flag which is generic,ah I see. The Shahadah having nothing to do with the Koran. Got you.,sydneysiege,comment
3178,553552287889494017,553548567420628992,"AFP reports there are  dead, and  hostages being held in the Kosher store in Eastern Paris; separate incident to charlie hebdo shooters.",Police have just confirmed the connection on,charliehebdo,support
3179,500367482679746560,500367139652784128,“PublicOffendor: yeah they faked the video LOLyour racist denial” oh please,did you see the video? do you think the police faked the video? are you saying this ISNT Michael brown?? please,ferguson,comment
3180,544324444773433348,None,,"Uber says it has hiked prices in Sydney to ""encourage more drivers to come online &amp; pick up passengers."" SydneySiege",sydneysiege,support
3181,544348620930433024,544348059501490177,"FWIW I think they're communicating fine now, that initial tweet was a grenade they should've rewritten.",".Mr_Odin That initial tweet was on point. Their customers, and the outraged, should have been smarter.",sydneysiege,comment
3182,500295853186510848,500294803402137600,Photos of alleged robbery involving Michael Brown in Ferguson (via police),RT Photos of alleged robbery involving Michael Brown in Ferguson (via police),ferguson,comment
3183,500335190146056192,500278045597368320,URGENT: Darren Wilson is the police officer who shot Mike Brown Ferguson,Urgent: Fearmonger much?,ferguson,query
3184,524973072504606720,524972433984323584,"lives are at stake because of Isis and extremist snakes and cowards, not Harper","that's the Canada we want, not a Canada that wants to send its military all over ME",ottawashooting,comment
3185,525057624916520960,525056576038518785,Soldier killed in Canada shooting was a young reservist with a six-year-old son,So sad for my great nation. I am speechless!,ottawashooting,comment
3186,500317791933972481,500312223471120384,"it STARTED as a race issue, then people tried to SWAY it to an issue of militarization, dont get it twisted",you imagine the shitstorm if this guy was black? Doubt U heard about it,ferguson,comment
3187,500391932934512640,500389488217309184,Ferguson chief let most of day go by b disclosing (after repeated Qs) that cop who killed MikeBrown knew nothing about robbery. DANGER,stranger by the second,ferguson,comment
3188,544278190936424449,544277407411097600,who could be doing this? And why? Don't expect bbc to tell you,Muslim extremists that's who.,sydneysiege,query
3189,524925050739490816,None,,BREAKING NEWS: Soldier shot at National War Memorial in Ottawa,ottawashooting,support
3190,553198944998543360,553197749240221699,"OK. But why precisely an ID, why not Seresta tablets?",it is not inconceivable that the terrorists were on anti-anxiety meds AND were amp'd.,charliehebdo,comment
3191,500311553183588352,500279160795721728,"Question for Ferguson police chief? If OFFICER DARREN WILSON was in pursuit of a robbery suspect, why tell kids to get out of the road? LIE","get outta d f'in road! (moreover). I'm sorry, time to call for the arrest now, of Mr. Darren Wilson.",ferguson,comment
3192,500295397886025729,500295232399757312,"Take a look at college football players, roughly same size and maturity (in terms of looking older).","my brother played, I'm familiar with their size",ferguson,comment
3193,525023449262333952,525019752507658240,"ISIS Media account posts picture claiming to be Michael Zehaf-Bibeau, dead OttawaShooting suspect. Canada","BBC News - Mr Merizier said that the attacker was of ""Arabic appearance"" and had ""long dark hair and a beard"".",ottawashooting,comment
3194,544284069518147584,544283772569788416,Live Updates: Siege in Sydney Cafe,get on with stop messing about,sydneysiege,comment
3195,524965523470434305,524964948683005952,"Ottawa police confirm to CBCNews they are still seeking  or more suspects after shootings on Parliament Hill, War Memorial, nearby mall.",That's two terrorist attacks under Harper and counting!,ottawashooting,comment
3196,529693591132983297,529690091221180416,*holds boom box to air and gets emosh with benji* PURPLE RAIN PURPLE RAINBNNN *insert hard electric guitar here*,we should be at this concert,prince-toronto,comment
3197,500282527559720960,500281916658958337,WHEN? he became a suspect upon the firing of the fatal shot?,exactly,ferguson,support
3198,525007275308908544,525003468659228672,These are not timid colours; soldiers back guarding Tomb of Unknown Soldier after today's shooting StandforCanada,So honoured to serve as Honorary Colonel in reserves. Job is to honour citizen soldiers like these brave men.,ottawashooting,support
3199,500315174633766912,500315038541156352,"I'm curious, had the suspect been white would the PD have acted the same?",p sure you know the answer to that question.,ferguson,comment
3200,500289895706144768,500286058664579072,Update: Ferguson police release stills from convenience store footage showing robbery,here goes the fukkry now look at his picture.o wait he is black robber black. Has it been confirmed. Or just blow smoke our bum,ferguson,comment
3201,544473329822756864,544470157670641664,ESpecially as Junior Hadley is a NSW Plod - wonder if he used his contacts to get stuff not public,"Yes, more than likely Frankie.",sydneysiege,comment
3202,553552036915335169,553551840428949504,A lot of shifting sands in the coverage right now. We'll know soon enough.,Speaking of,charliehebdo,comment
3203,544520381952835584,544520273718812672,Police confirm that sydneysiege is finally over. Two people reportedly injured after suffering gunshot wounds,both dead angus   injured,sydneysiege,comment
3204,553165585115516928,553164985460068352,The CharlieHebdo attack suspects have reportedly fired shots while robbing a petrol station,"It appears Thelma &amp; Louise have rocket launchers, numpties! JeSuisCharlie",charliehebdo,comment
3205,525037638898954240,525025463648137216,BREAKING: A source confirms to CP that the deceased soldier in Ottawa is Cpl. Nathan Cirillo. Cirillo was a member of the Hamilton Argylls,Condolences to Cpl.'s family/friends “CP: BREAKING: deceased soldier in Ottawa is Cpl. Nathan Cirillo...member of the Hamilton Argylls”,ottawashooting,support
3206,500938515367342080,500304014765199360,Sadly DorianJohnson friend of MichaelBrown was in store also &amp; has admitted to it,Dorian's lawyer said in CNN interview Dorian had admitted it as he give his witness statement,ferguson,comment
3207,500395569760972800,500394049501544449,Dorian Johnson just confirmed it was them. What now? blackdenial,Good job getting (a guy who looks a bit like a) petty thief off the street (four hours after shooting him),ferguson,comment
3208,544292284259262464,544290258951892992,Central Sydney shut down by police amid ongoing hostage situation:,diversity,sydneysiege,comment
3209,500289033650446338,500286058664579072,Update: Ferguson police release stills from convenience store footage showing robbery,that dude is huge,ferguson,comment
3210,524984000134520834,524983581983375360,"Police now say there were two shooting incidents in Ottawa: one at the war memorial, the other on Parliament Hill.",let's wish the best for Canada and this time of tragedy,ottawashooting,comment
3211,544282322779250688,544282227035869184,"BREAKING NEWS: Gunmen take hostages at Sydney cafe, wave Islamic flag",not the Islamic flag.....,sydneysiege,deny
